Hospice of the Eastern Upper Peninsula,0,308 W 12TH AVE SAULT S MARIE   MI 49783 ,38-2472423,hospice@hospiceoftheeup.com,WWW.HOSPICEOFTHEEUP.COM,906-253-3151,Human Service,Hospice is dedicated to providing community support to individuals and families touched by life threatening illness  grief and loss.,TO SERVE RESIDENTS OF CHIPPEWA AND MACKINAC COUNTIES BY PROVIDING SERVICE AND SUPPORT FOR THE TERMINALLY AND CHRONICALLY ILL AND MEMBERS OF THEIR FAMILY. HOSPICE PROVIDES PATIENT CARE  TRANSPORTATION  ERRAND RUNNING  BEREAVEMENT SUPPORT AND EDUCATION SERVICES.,NA,Photo save,NA,NA,This organization is required to file an IRS Form 990 or 990-EZ.,https://www.facebook.com/Hospiceoftheeup/,Hospice of the E.U.P does not have any upcoming events.,NA,NA,19/3/2018,
Fonag Inc,0,40946 CROSSBOW CIR APT 105 CANTON  MI 48188 ,41-2186965,NA,NA,NA,Human Service,Non profit organization,PROVIDE ROOM AND BOARD FOR THE DEVELOPMENTALY DISABLED (D.D.), AND MENTALLY ILL (M.I.) ADULTS OF 18 - 65 YEARS OLD IN MICHIGAN STATE. A TOTAL NUMBER OF 12 CLIENTS WERE SERVED IN THE YEAR 2016.,NA,NA,NA,This organization is required to file an IRS Form 990 or 990-EZ.,NA,NA,NA,NA,NA,
Inter-Disciplinary Advantage Inc,0,2603 W WACKERLY ST STE 201 MIDLAND   MI 48640 ,38-2941452,NA,www.cscso.com,989-631-6691,Human Service,Non profit organization,RESIDENTIAL CARE SERVICES FOR INDIVIDUALS WITH MENTAL ILLNESS OR DEVELOPMENTAL DISABILITIES.,NA,NA,NA,NA,This organization is required to file an IRS Form 990 or 990-EZ.,https://www.facebook.com/pages/Central-State-Community-Service/202197450121830,NA,NA,NA,19/3/2018,
Just,0,600 W LAFAYETTE BLVD FL 4TH DETROIT  MI 48226 ,26-0184868,NA,NA,313-964-4454,Human Service,Non profit organization,RECEIVE & ADMINISTER FUNDS THROUGH GOLF TOURNAMENTS AND OTHER EVENTS TO BE USED FOR CHARITABLE AND/OR EDUCATIONAL PURPOSES OFTEN THRU OTHER 501(C)(3) ORGANIZATIONS.,NA,NA,NA,NA,This organization is required to file an IRS Form 990 or 990-EZ.,NA,NA,NA,NA,19/3/2018,
Precious Care Group Inc,0,12368 EVANSTON ST DETROIT   MI 48213 ,20-8601943,NA,NA,313-465-9199,Human Service,Non profit organization,TO PROVIDE TRAINING AND ASSIST CONSUMERS TO ACQUIRE  MAINTAINED OR IMPROVE SKILLS RELATED TO ACTIVITIES OF DAILY LIVING.,NA,NA,NA,NA,This organization is required to file an IRS Form 990 or 990-EZ.,NA,NA,NA,NA,19/3/2018,
Quality A F C Home Inc,0,523 ORCHARD LAKE RD PONTIAC  MI 48341 ,38-3177008,NA,NA,248-496-6904,Human Service,ADULT FOSTER CARE FACILTY FOR THE DISABLED PERSONS,NA,NA,NA,NA,NA,This organization is required to file an IRS Form 990 or 990-EZ.,NA,NA,NA,NA,19/3/2018,
Macomb County Interfaith Volunteer Caregivers,0,8075 Ritter Center Line  MI 48015 ,38-3180665,NA,WWW.IVC.ORG,586-757-5551,Human Service,Citizen Diplomacy International connects the international community and the people of Philadelphia  one person and one new friendship at a time.  We showcase the best of our region through international business  educational and cultural exchanges.  Through personal interactions  we promote mutual respect and understanding.,Drawing from religious  business  civic and individual resources  the Interfaith Volunteer care givers work to meet the two mutually entwined and equally important purposes to respond to the ever-growing needs of older and physically challenged adults living in our communities who struggle daily to maintain their independence at home  while providing meaningful opportunities for volunteers of all ages and abilities to enrich their lives and live out their faith by helping others,NA,Photo save,NA,NA,This organization is required to file an IRS Form 990 or 990-EZ.,https://www.facebook.com/cdiPhila,2018 Annual Meeting & Cocktail Reception  Thursday  April 5  2018  5:30 PM - 8 PM  Free Library of Philadelphia Central Library  Skyline Room  1901 Vine St.  Philadelphia  PA 19103,NA,NA,19/3/2018,
Help Pregnancy Crisis Aid Inc,0,705 BRIDGE ST NW GRAND RAPIDS   MI 49504 ,23-7314063,info@helppregnancy.org,WWW.HELPPREGNANCY.ORG,616-459-9139,Human Service,Lifes challenges  offer LIFE choices. Youre not alone  HELP exists as a place all options can be explored. Be courageous give us a call or come by.,TO HELP WOMEN IN POVERTY WITH THEIR INFANTS AND NEWBORN BABIES,Volunteer apportunity Client Advocates  Bilingual Advocates  Receptionist  Clothing Sorters  Sewing.,Photo save,NA,NA,This organization is required to file an IRS Form 990 or 990-EZ.,https://www.facebook.com/HelpPregnancy,Help Pregnancy Crisis Aid does not have any upcoming events.,NA,NA,19/3/2018,
Central County Center Inc,0,PO BOX 252 BERRIEN SPRGS  MI 49103 ,38-2077349,NA,NA,269-471-2017,Human Service,Non profit organization,TO PROVIDE NEEDED SERVICES TO ENHANCE  ENCOURAGE AND PROMOTE THE INDEPENDENT LIVING OF OUR OLDER POPULATION.,NA,Photo save,NA,NA,This organization is required to file an IRS Form 990 or 990-EZ.,https://www.facebook.com/pages/Central-County-Center-for-Senior-Citizen/166019303424534,NA,NA,NA,19/3/2018,
Club General Motors,0,53676 SHERWOOD LN SHELBY TWP   MI 48315 ,38-3569669,NA,NA,586-781-3485,Human Service,Non profit organization,TO ENCOURAGE ITS MEMBERS TO SUSTAIN A KEEN INTEREST IN THE POLICIES OF GM AND TO PROMOTE AND COORDINATE CHARITABLE EFFORTS OF ITS MEMBERS.,NA,NA,NA,NA,This organization is required to file an IRS Form 990 or 990-EZ.,NA,NA,NA,NA,19/3/2018,
Mission Partners India Inc.,0,100 South Pine St Suite 167 Zeeland  49464 ,81-0552652,gannhope@gmail.com,www.missionpartnersindia.com,616-748-6034,Human Service,Non profit organization,MPI works to address the need for education and job creation for marginalized women and children in South India. Through sustainable programs such as the Give-A-Cow Program and Banyan Tree Tailoring Program the poorest of the poor are equipped with the skills needed to provide food and shelter for their families which brings dignity. Through the development project of digging water wells  mission insitutions can provide drinking water for the children and maintain vegetable gardens that provides food to the needy children at the mission schools.,NA,NA,P.O. Box 168 Zeeland  MI 49464 USA,NA,This organization is required to file an IRS Form 990 or 990-EZ.,NA,NA,NA,NA,19/3/2018,
Life Choices of Central Michigan,0,904 E. Preston St. Mt. Pleasant  MI 48858 USA,38-2728543,kate@lifechoicescm.com,www.lifechoicescm.com,989-773-0379,Human Service,Non profit organization,Protecting life. Sharing the Truth. Empowering people to make healthy Life Choices.,NA,NA,NA,NA,This organization is required to file an IRS Form 990 or 990-EZ.,NA,NA,NA,NA,19/3/2018,
Hospice of Central Michigan Inc,0,2597 S MERIDIAN RD MT PLEASANT   MI 48858 ,38-2468638,NA,www.woodlandhospice.com,989-773-6137,Human Service,Non profit organization,The mission of Woodland Hospice is to provide high quality  dignified  compassionate  end-of-life care to people with terminal illness; to promote the long-term emotional  spiritual and physical well-being of caregivers and survivors; to provide expertise in palliative  supportive and bereavement care to professionals  as well as to the community at large.,NA,NA,NA,NA,This organization is required to file an IRS Form 990 or 990-EZ.,NA,NA,NA,NA,19/3/2018,
St Jude Iraq,0,45700 DEQUINDRE RD SHELBY TWP  MI 48317 ,47-4482096,NA,WWW.STJUDEIRAQ.ORG,NA,Human Service,St Jude Iraq was started to help children in Iraq. We provide aid & support to handicapped  sick  war afflicted and/or orphan children. Help us  help them.,St. Jude of Iraq is a non-profit community based organization that reaches out to orphaned children and their guardians in Iraq and provides the support they are otherwise lacking from their local communities. The mission of St. Jude of Iraq is to improve the lives of orphans and at-risk children primarily in Iraq through the care and support of the community. Our goal is the growth of the life of an orphan in the areas of education and faith  thus meeting the physical  emotional  educational  and spiritual needs of the children. We hope to empower them so they can lead productive lives beyond the orphanage. It is our duty to do everything possible to help children living in orphanages and similar institutions to reach their full potential.,NA,Photo save,NA,NA,This organization is required to file an IRS Form 990 or 990-EZ.,https://www.facebook.com/stjudeiraq/,St. Jude Iraq does not have any upcoming events.,NA,NA,19/3/2018,
Give-a-Kid-Projects,0,PO BOX 576 HOLT   MI 48842 ,26-2535665,gakp@giveakidprojects.org,WWW.GIVEAKIDPROJECTS.ORG,517-282-8115,Human Service,Non profit organization,These projects provide the disadvantage with some of their needs in the areas of school supplies  warm clothing  household items and age-appropriate gifts.,NA,Photo save,NA,517-694-1230,This organization is required to file an IRS Form 990 or 990-EZ.,NA,NA,NA,NA,19/3/2018,
Kittys Place Inc,0,1114 1ST ST WYANDOTTE   MI 48192 ,38-2734384,maeic1@yahoo.com,NA,248-609-0544,Human Service,Kitty???s Place is a Federally Designated 501(c)(3) Non Profit Corporation established to serve the needs of emotionally and/or mentally challenged women.,ADULT FOSTER CARE HOME,NA,Photo save,NA,NA,This organization is required to file an IRS Form 990 or 990-EZ.,https://www.facebook.com/pg/Kittys-Place-Adult-Foster-Care-270263356815034/about/?ref=page_internal,NA,NA,NA,19/3/2018,
YWCA Great Lakes Bay Region,0,723 Washington Ave Bay City  MI 48708 USA,38-1367099,mistyjanks@ywcaglbr.org,www.ywcaglbr.org,989-894-9055,Human Service,YWCA Great Lakes Bay Region founded in 1891 is a womens organization supported by the National YWCA and World YWCA.,YWCA Great Lakes Bay Region is dedicated to eliminating racism  empowering women and promoting peace  justice  freedom and dignity for all.,NA,Photo save,NA,NA,This organization is required to file an IRS Form 990 or 990-EZ.,https://www.facebook.com/ywcaglbr,YWCA Riverside Art Festival  Jun 9 2018  Bay City  Michigan 48708,YWCA Riverside Art Festival  Jun 10 2018  Bay City  Michigan 48708,NA,19/3/2018,
North Flint Reinvestment Corporation,0,6103 EAGLE RIDGE LN FLINT  MI 48505 ,61-1583065,NA,www.northflintreinvestmentcorp.com,NA,Human Service,The North Flint Reinvestment Corporation  Inc. is a non-profit  501(c)(3)  community and economic development corporation organized to implement a holistic approach to community revitalization in North Flint. The corporation is comprised of a grass-roots network of public and private sector partners committed to rebuilding and revitalizing economically distressed neighborhoods in North Flint.,This organization has not provided GuideStar with a mission statement.,NA,Photo save,NA,NA,This organization is required to file an IRS Form 990 or 990-EZ.,NA,NA,NA,NA,19/3/2018,
Ishpeming Cancer Society,0,7955 COUNTY ROAD PI ISHPEMING  MI 49849 ,38-2251717,NA,WWW.CANCERCAREMQTCOUNTY.COM,906-486-9861,Human Service,Non profit organization,OUR VOLUNTEER ORGANIZATION PROVIDES PATIENT SERVICES TO CANCER PATIENTS WHO ARE UNABLE TO RESPOND TO THE CATASTROPHIC HEALTH CARE COSTS ASSOCIATED WITH THEIR TREATMENT. WE ALSO SPONSOR PREVENTION/DETECTION PROGRAMS FOR CITIZENS OF MARQUETTE COUNTY AND PARTICIPATE IN SIMILAR CANCER PROGRAMS SPONSORED BY OTHER COUNTY ORGANIZATIONS.,NA,NA,NA,NA,This organization is required to file an IRS Form 990 or 990-EZ.,NA,NA,NA,NA,19/3/2018,
World Community Impact Incorporated,0,273565 ANN ARBOR TRAIL DEARBORN HEIGHTS   MI 48127 ,38-3601417,NA,NA,313-730-8900,Human Service,Non profit organization,PROVIDES DAY CARE SERVICES TO LOW INCOME FAMILIES,NA,NA,NA,NA,This organization is required to file an IRS Form 990 or 990-EZ.,NA,NA,NA,NA,19/3/2018,
Paradise Bound Thrift Shoppe,0,59 W WASHINGTON AVE STE E ZEELAND   MI 49464 ,26-3935772,thriftstore@paradisebound.org,www.paradisebound.org,616-748-7690,Human Service,Thrift store and resale shoppe of Guatemalan goods right in the beautiful town of Zeeland! Donate your items and time to help the ministries in Guatemala.,PARADISE BOUND THRIFT SHOPPES PRINCIPLE PURPOSE IS TO OPERATE A THRIFT SHOP AND TO PAY ITS NET EARNINGS TO PARADISE BOUND MINISTRIES THAT OWNS AND OPERATES A MISSION BASE IN GUATEMALA.,NA,Photo save,NA,NA,This organization is required to file an IRS Form 990 or 990-EZ.,https://www.facebook.com/pg/ParadiseBoundThrift/about/?ref=page_internal,NA,NA,NA,19/3/2018,
South Lansing Ministries Inc,0,4301 S WAVERLY RD LANSING  MI 48911 ,35-2240214,southlansingministries@comcast.net,NA,517-882-0661,Human Service,Community services: food pantry  personal needs  computer bank  information and referral,Providing an oasis of hope  and support for those in need.,NA,Photo save,NA,NA,This organization is required to file an IRS Form 990 or 990-EZ.,https://www.facebook.com/pg/South-Lansing-Ministries-922081417853144/about/?ref=page_internal,South Lansing Ministries does not have any upcoming events.,NA,NA,19/3/2018,
Benton Harbor Benton Township Senior Services Incorporated,0,225 COLFAX AVE BENTON HARBOR   MI 49022 ,38-2079361,NA,NA,269-927-2497,Human Service,Non profit organization,PROVIDE PROGRAMS AND ACTIVITIES FOR THE SENIORS OF BENTON HARBOR.,NA,NA,NA,NA,This organization is required to file an IRS Form 990 or 990-EZ.,NA,NA,NA,NA,19/3/2018,
Michigan Vegetable Council Inc,0,PO Box 277 Erie   MI 48133 ,23-7017793,mivegcouncil@charter.net,www.michiganvegetablecouncil.org,734-848-8899,Agriculture  food and nutrition,The Great Lakes Fruit  Vegetable and Farm Market EXPO is the largest show of its kind in the country. It is held each year in early December at DeVos Place Convention Center in Grand Rapids  Mich. The Great Lakes EXPO  as it???s commonly known  was first held in December 2001 when the Michigan State Horticultural Society and the Michigan Vegetable Council combined their respective education and trade shows.,TO RESEARCH VEGETABLES FOR FARMERS IN MICHIGAN.,NA,Photo save,NA,NA,This organization is required to file an IRS Form 990 or 990-EZ.,https://www.facebook.com/pages/Michigan-Vegetable-Council/159350977430906,NA,NA,NA,26/3/2018,
Detroit Zoological Society,0,8450 W 10 Mile Road Royal Oak  MI 48067 USA,38-6027356,JKrueger@dzs.org,www.detroitzoo.org,248-541-5717,Animal Related,Zoo Park and Pet care service,The Mission of the Detroit Zoological Society is to: Demonstrate leadership in wildlife conservation and animal welfare; Provide a broad audience with outstanding and unique educational opportunities that lead to the appreciation and stewardship of nature; Inspire our community with engaging  meaningful and memorable experiences; Provide innovative zoological facilities that contribute to the regions economic vitality; and Demonstrate organizational excellence consistent with a commitment to outstanding service  progressive resource management and environmental leadership.,NA,Photo save,NA,NA,This organization is required to file an IRS Form 990 or 990-EZ.,https://www.facebook.com/detroitzoologicalsociety,Mudpuppypalooza  Sunday  April 8 at 11 AM - 3 PM EDT  Detroit  Michigan,GreenFest  Saturday  April 14 at 10 AM - 3 PM EDT  8450 W 10 Mile Rd  Royal Oak  Michigan 48067,Green Day  Saturday  April 21 at 11 AM - 3 PM EDT  Detroit  Michigan,21/3/2018,
Great Lakes Fishery Commission,0,2100 COMMONWEALTH BLVD STE 100 ANN ARBOR  MI 48105 ,38-1539304,NA,WWW.GLFC.ORG,734-662-3209,Animal Related,The Great Lakes Fishery Commission was established in 1955 by the Canadian/U.S. Convention on Great Lakes Fisheries. The commission coordinates fisheries research  controls the invasive sea lamprey  and facilitates cooperative fishery management among the state  provincial  tribal  and federal management agencies.,GREAT LAKES FISHERY COMMISSION IS AN INTERNATIONAL TREATY ORGANIZATION ESTABLISHED TO MANAGE SEA LAMPREY AND IMPROVE FISH STOCKS IN THE GREAT LAKES.,NA,Photo save,NA,NA,This organization is required to file an IRS Form 990 or 990-EZ.,https://www.facebook.com/LampreyControl/,NA,NA,NA,21/3/2018,
Michigan Humane Society,0,30300 Telegraph Road Suite 220 Bingham Farms  MI 48025 USA,38-1358206,dginis@michiganhumane.org,www.michiganhumane.org,248-283-1000,Animal Related,Founded in 1877  the Michigan Humane Society is the states oldest and largest animal welfare organization and works to improve and save lives through compassionate care  community engagement and advocacy for animals.,The mission of the Michigan Humane Society is to improve and save lives through compassionate care  community engagement and advocacy for animals.,Whether you wish to work at a Michigan Humane Society adoption center  our administrative office  or at special events  the MHS Volunteer Program provides a wide variety of opportunities for concerned  caring individuals to help make a difference in the lives of animals today. MHS offers a structured  well-supported program and truly appreciates our dedicated volunteers who help us change animal lives every day. In order for MHS to provide the best possible program for the animals and volunteers alike  potential volunteers will fill out an online application  and register for a welcome meeting; depending on your interests and open volunteer positions  further training may be required.,Photo save,NA,NA,This organization is required to file an IRS Form 990 or 990-EZ.,https://www.facebook.com/michiganhumane,Sgt. Stubbys On Screen Countdown  Apr 13 at 6 AM to Apr 26 at 9 PM EDT  United States,NA,NA,21/3/2018,
John Ball Zoo,0,PO Box 2506 Grand Rapids  MI 49501 USA,38-6076879,info@jbzoo.org,www.jbzoo.org,616-336-4301,Animal Related,Zoo Park and Pet care service,John Ball Zoo inspires our community to be actively engaged in the conservation of wildlife and our natural environment.,Adult Volunteer Opportunities  For those 18+: Animal Care - Keeper Help  or Commissary  Animal Care - Diver  Education  Horticulture  Teen Volunteer Opportunities  For those entering 9th-12th grade in fall  Counselor in Training or CIT  Zoo Teen  Group Volunteer Opportunities  One time volunteering for corporate or college groups,Photo save,1300 West Fulton St Grand Rapids  MI 49504 ,NA,This organization is required to file an IRS Form 990 or 990-EZ.,https://www.facebook.com/pg/JBZoo/about/?ref=page_internal,FrogWatch Volunteer Training  Saturday  April 14 at 2 PM - 3:30 PM EDT  1300 W. Fulton St.  49504,West Fest  17th May 2018  4:00PM  John Ball Park Dr NW  Grand Rapids  MI 49504  United States,West Fest  18th May 2018  12:00PM  John Ball Park Dr NW  Grand Rapids  MI 49504  United States,21/3/2018,
HUMANE SOCIETY OF HURON VALLEY,0,3100 Cherry Hill Rd Ann Arbor  MI 48105 USA,38-1474931,jaci@hshv.org,www.hshv.org,734-662-5585,Animal Related,HSHV is a not-for-profit  tax-exempt public charity. We are independently run and rely on the generosity of people like you to continue our mission to support the loving  responsible care of every animal in our community. HSHV is not affiliated with or funded by Michigan Humane Society or any other humane organization.,Pet adoptions  Full-service affordable veterinary clinic  Dog training  Trap-Neuter-Return program  Barn cats  Humane wildlife removal service  24/7 emergency animal rescue  Humane education  including childrens birthday parties and Camp PAWS  And be sure to check out our new cat caf??: The Tiny Lions lounge and adoption Center!,NA,Photo save,NA,NA,This organization is required to file an IRS Form 990 or 990-EZ.,https://www.facebook.com/humanesocietyhuronvalley,Tiny Lions New Volunteer Orientation  26th May 2018  7:30PM  5245 Jackson Rd  Suite A1  Ann Arbor  Michigan 48103,Tiny Lions New Volunteer Orientation  28th July 2018  7:30PM  5245 Jackson Rd  Suite A1  Ann Arbor  Michigan 48103,Family Mew-vie Night  13th April 2018  7:30PM  5245 Jackson Rd  Suite A1  Ann Arbor  Michigan 48103,21/3/2018,
Robert F Beard Charitable Foundation,0,PO Box 698 Ada  MI 49301 ,38-3168934,NA,NA,734-453-0209,Animal Related,NA,NA,NA,NA,NA,NA,This organization is required to file an IRS Form 990 or 990-EZ.,NA,NA,NA,NA,21/3/2018,
Michigan Anti Cruelty Society,0,13569 JOS CAMPAU DETROIT  MI 48212 ,38-1420301,info@macsshelter.org,www.macsshelter.org,313-891-7188,Animal Related,Since 1935  the Michigan Anti-Cruelty Society (MACS) has dedicated its efforts to providing refuge to stray  injured  and forgotten animals. We work to promote humane education and actively initiate affirmative legislative action.,TO MAINTAIN AND OPERATE A HOSPITAL  AMBULANCE AND VETERINARY SERVICES FOR THE CARE OF ANIMALS. THE MAINTENANCE AND OPERATION OF KENNELS AND SUITABLE CHAMBERS FOR THE HUMANE DESTRUCTION OF WOUNDED ANIMALS.,NA,Photo save,13557 Joseph Campau Detroit  MI 48212,313-369-9863,This organization is required to file an IRS Form 990 or 990-EZ.,https://www.facebook.com/pg/macs1935/about/?ref=page_internal,Michigan Anti-Cruelty Society does not have any upcoming events.,NA,NA,21/3/2018,
Binder Park Zoological Society  Inc.,0,7400 Division Dr Battle Creek  MI 49014 USA,51-0163223,dthompson@binderparkzoo.org,www.binderparkzoo.org,269-979-1351,Animal Related,Connecting kids and families with animals and fun is what Binder Park Zoo is all about! A trip to the Zoo offers families a chance to experience a quality recreational experience while being surround by nature. Situated on 433 acres  Binder Park Zoo is not your typical Zoo and features a variety of rides and exhibits  like the award-winning Wild Africa. In Wild Africa  guests go on safari through a 50-acre African national park; including an 18-acre savannah hosting herds of impala  zebra  antelope  gazelle  and ostrich  and the Twiga Overlook where you can hand-feed one of the nation???s largest herds of giraffe! Upon your arrival back to the U.S.  you are greeted by Mexican wolves  Chinese red pandas  kangaroos and a snow leopard! Don???t forget to stop by and see the three American black bears recently added to the Zoo.,Through nurturing empathy  understanding  and conservation of nature  Binder Park Zoos mission is to impact our regions economy  to meet the social needs of our region  and to educate our constituents to the wonders of the world.,NA,Photo save,NA,NA,This organization is required to file an IRS Form 990 or 990-EZ.,https://www.facebook.com/binderparkzoo,Binder Park Zoo does not have any upcoming events.,NA,NA,21/3/2018,
Little Traverse Bay Humane Society,0,1300 W CONWAY RD HARBOR SPGS  MI 49740 ,38-1384441,NA,www.ltbhs.com,231-347-2396,Animal Related,Serving the needs of homeless animals in the community since 1951  Little Traverse Bay Humane Society is a no-kill shelter that offers a temporary home to companion animals. Little Traverse Bay Humane Society is located between Harbor Springs and Petoskey  Michigan  and offers pet adoptions in addition to veterinary services  boarding  grooming  doggy daycare and training.,Little Traverse Bay Humane Society is a donor-funded  non-profit corporation that offers a temporary home to companion animals. As a no-kill shelter  our mission is to offer warm shelter  veterinary services  and personal attention to all the animals in our care  as well as proactive methods to control pet overpopulation. Little Traverse Bay Humane Society is committed to educating the public about the humane treatment of companion animals.,NA,Photo save,NA,NA,This organization is required to file an IRS Form 990 or 990-EZ.,https://www.facebook.com/ltbhs/,Junk in the Trunk  Saturday  June 2 at 10 AM - 1 PM EDT  1922 M 119  Petoskey  Michigan 49770,NA,NA,21/3/2018,
All About Animals Rescue,0,23451 Pinewood Street Warren  MI 48091 USA,20-3006686,clinic@allaboutanimalsrescue.org,www.allaboutanimalsrescue.org,586-879-1745,Animal Related,All About Animals Rescue is a 501 (c)(3) non-profit animal welfare organization working to stop pet homelessness before it starts. The mission is clear; No More Homeless Pets. Founded in Michigan in 2005  we focus on the fundamentals; reducing overpopulation and facilitating health  education and adoption. We provide low-cost to no-cost  high quality  high volume  spay/neuter; affordable wellness care; community cat management solutions and pet adoption. We are the largest spay/neuter clinic in the United States and make our services available to the public  shelters  rescue community and municipalities.,AAAR???s vision is clear ??? No More Homeless Pets. This can be accomplished by focusing on the fundamentals ??? reducing overpopulation and facilitating health and adoption. AAAR seeks to promote that vision by becoming the premier spay/neuter and adoption provider in the State of Michigan. Through individual and collaborative efforts  the vision of No More Homeless Pets is within our sights.,NA,Photo save,NA,NA,This organization is required to file an IRS Form 990 or 990-EZ.,https://www.facebook.com/allaboutanimalsrescue,Hazel Park Shot Clinic  Saturday  April 14 at 10 AM - 2 PM EDT  24211 Couzens Ave  Hazel Park  MI 48030-1247  United States,Stray Cats? TNR - Trap Neuter Return Training and Community Cat Education Class  Sunday  April 8 at 11:30 AM - 2 PM EDT  23451 Pinewood St  Warren  Michigan 48091,Flint TNR Class - Find out how to help stray cats!  Sunday  April 15 at 2 PM - 4:30 PM EDT  W Atherton Rd  Flint  MI 48507  United States,21/3/2018,
