GRAND RAPIDS HQ,0,320 State ST SE Grand Rapids  MI 49503 USA,46-5549116,ssteininger@hqgr.org,WWW.HQGR.ORG,616-406-3945,Human Service,HQ is a drop-in center for youth ages 14 thru 24 who are experiencing unsafe or unstable housing. To create a safe and affirming space where youth can find rest  build connections and pursue their passions to realize their dreams.,To provide a safe and affirming space for youth to find rest  build connections and pursue their passions to realize their dreams.,NA,Photo save,NA,NA,This organization is required to file an IRS Form 990 or 990-EZ.,https://www.facebook.com/HQGrandRapids,Notos Spring Charity Wine Fest  Friday  March 23 at 6 PM - 10 PM EDT  6600 28th St SE  Grand Rapids  Michigan 49546,Walk for Good Food  Sunday  May 6 at 1:30 PM - 4:30 PM EDT  10 E Park Pl NE  Grand Rapids  Michigan 49503,NA,13/3/2018,
Shiawassee County Arc,0,1905 W. M-21 PO Box 63 Owosso  MI 48867 USA,38-6030234,arcshia@michonline.net,www.arcofshiawassee.org,989-723-7377,Human Service,The Arc offices first opened in February 1978 in Corunna and the following year began a research program to identify persons with developmental disabilities  a large step in the advocacy aspect of The Arc  bringing awareness to the public and getting assistance for those with disabilities.,Our mission is to empower people with developmental disabilities in Shiawassee County to participate in  and be fully included in  the community.,Volunteers are a vital part of the Arc  they help support programs and assist with fundraising for the organization. Volunteers assist with respite  recreation events  bingo and summer camp among many.,Photo save,NA,NA,This organization is required to file an IRS Form 990 or 990-EZ.,https://www.facebook.com/share.php?u=http%3A%2F%2Farcofshiawassee.org%2F&t=Welcome%20to%20The%20Arc%20Shiawassee%21,The Arc Shiawassee does not have any upcoming events.,NA,NA,13/3/2018,
Birmingham Area Seniors Coordinating Council,0,2121 MIDVALE ST BIRMINGHAM   MI 48009 ,38-2280601,ktillson@birmingham.k12.mi.us,WWW.BIRMINGHAMNEXT.ORG,248-203-5270,Human Service,Next is a nonprofit center that provides a wide range of activities  enrichment  and support services for the growing 50+ population in the community.,TO IDENTIFY AND MEET THE NEEDS OF OLDER ADULTS BY SOLICITING AND COORDINATING COMMUNITY RESOURCES TO PROVIDE EDUCATIONAL  RECREATIONAL AND SOCIAL PROGRAMS  SUPPORTIVE OUTREACH SERVICES AND VOLUNTEER OPPORTUNITIES.,NA,Photo save,NA,NA,This organization is required to file an IRS Form 990 or 990-EZ.,https://www.facebook.com/BirminghamNext,Next - Your Place to Stay Active and Connected does not have any upcoming events.,NA,NA,13/3/2018,
Michigan Federation for Children and Families,0,320 N WASHINGTON SQ STE 100 LANSING  MI 48933 ,38-2628219,NA,WWW.MICHFED.ORG,517-485-8552,Human Service,The Michigan Federation for Children and Familie-through its staff and member-works tirelessly on behalf of children and families and the private  nonprofit agencies serving Michigans most vulnerable citizens. The reasons why are clear in our mission  but the ways we influence funding  programs and operations through action leading to success are diverse and powerful.,The mission of the Michigan Federation for Children and Families is to unite private  nonprofit human service providers  advocates  customers  individuals and funders to... influence public policy in support of children  families and individuals reaching their full potential; identify  develop and implement efficient and effective services to Michigans most vulnerable children and families; and support and enhance the ability of Michigans private  nonprofit agencies to provide human services.,NA,Photo save,NA,NA,This organization is required to file an IRS Form 990 or 990-EZ.,https://www.facebook.com/dialog/share?app_id=5303202981&display=popup&href=http%3A%2F%2Fmichfed.org%2F&redirect_uri=https%3a%2f%2fstatic.addtoany.com%2fmenu%2fthanks.html%23url%3dhttp%3A%2F%2Fmichfed.org%2F&quote=,Behavioral Health MIN  03/21/2018 - 10:00am to 12:00pm  ,NA,NA,13/3/2018,
Domestic and Sexual Abuse Services,0,PO BOX 402 THREE RIVERS  MI 49093 ,38-2590266,abigailr@dasasmi.org,WWW.DASASMI.ORG,269-279-5122,Human Service,Domestic And Sexual Abuse Services is a 501(c)3 non-profit serving men  women and children harmed by domestic/sexual/partner violence.,TO PROVIDE SHELTER AND ASSISTANCE TO WOMEN AND CHILDREN AFFECTED BY DOMESTIC VIOLENCE AND ABUSE.,Your support will help ensure we are able to continue offering these vital services to survivors and their children: Emergency Shelter  24-Hour Crisis Hotline  Domestic Violence Supportive Services  Sexual Assault Supportive Services  Prevention Education - Healthy Relationships Program  24- Hour Emergency Response Program.,Photo save,NA,800-828-2023,This organization is required to file an IRS Form 990 or 990-EZ.,https://www.facebook.com/pages/Domestic-And-Sexual-Abuse-Services/208828712469238,NA,NA,NA,15/3/2018,
Kambly Living Center,0,1003 North Ave Battle Creek  MI 49017 ,38-1622320,klcdirector@sbcglobal.net,WWW.KAMBLY.ORG,269-965-5539,Human Service,"Kambly is a state award winning  30 bed  nonprofit adult foster care facility serving people with developmental disabilities. Started in 1949 by Viola Kambly as a boarding school for mentally impaired children  Kambly has evolved into an adult foster care home that is considered a ""preferred provider"" by community mental health and social service professionals. ",Kambly Living Center provides adults with developmental disabilities a family home environment as an alternative to institutionalized living. We offer quality care in a comfortable  secure setting with activities and services designed to enhance their independence and dignity. We are situated in a residential area on six acres of land within minutes of medical offices  the hospital  recreation  and transportation. We invite you to learn more about Kambly Living Center.,NA,Photo save,NA,NA,This organization is required to file an IRS Form 990 or 990-EZ.,https://www.facebook.com/pg/KamblyLiving/community/?mt_nav=0,2018 Knocking em??? Down For Kambly!  Sunday March 18th at 3 p.m. M-66 Bowl 19794 Capital Ave. N.E.,NA,NA,15/3/2018,
Cleveland Manor Inc,0,2200 CLEVELAND AVENUE MIDLAND  MI 48640 ,38-1794600,info@clevelandmanor.org,WWW.CLEVELANDMANOR.ORG,989-631-6480,Human Service,Cleveland Manor is a not-for-profit corporation run by a board of directors and on-site management. Our smoke-free  pet friendly community offers affordable leasing options for those age 62 and over  as well as persons under 62 with a disability (must be at least age 18 to qualify).,PROVIDE LOW-INCOME HOUSING FOR SENIORS 62 OR OLDER.,NA,Photo save,NA,NA,This organization is required to file an IRS Form 990 or 990-EZ.,https://www.facebook.com/pages/Cleveland-Manor/198188776978155,NA,NA,NA,15/3/2018,
Nova Vida Inc,0,PO BOX 92 CHARLOTTE  MI 48813 ,38-2783238,NA,NA,517-543-4195,Human Service,Non profit organization,PROVIDE ADULT FOSTER CARE FOR MENTALLY HANDICAPPED INDIVIDUALS.,NA,NA,NA,NA,This organization is required to file an IRS Form 990 or 990-EZ.,https://www.facebook.com/pages/Nova-Vida-Inc/1054855867888498,NA,NA,NA,15/3/2018,
Great Beginnings Christian Child Care Center Inc,0,2839 LIBERTY RD SAGINAW   MI 48604 ,38-2750581,NA,NA,989-754-6600,Human Service,Great Beginnings Christian Child Care Center is dedicated to fostering the young child???s total growth in a Christian atmosphere. Children grow and change rapidly and every experience in which he/she participates is influential to his/her total growth. Every experience - everything that happens to a child - in some way contributes to his/her growing concept of self. ,PROVIDE DAY CARE AND EDUCATION,NA,Photo save,NA,NA,This organization is required to file an IRS Form 990 or 990-EZ.,https://www.facebook.com/pg/Great-Beginnings-Christian-Childcare-Center-177561488948584/about/?ref=page_internal,Great Beginnings Christian Childcare Center does not have any upcoming events.,NA,NA,15/3/2018,
Refugee Development Center,0,600 W MAPLE ST SUITE A LANSING  MI 48906 ,26-3936253,info@rdclansing.org,WWW.REFUGEEDEVELOPMENTCENTER.ORG,517-999-5090,Human Service,The Refugee Development Center (RDC) is a grassroots organization offering formal and informal learning opportunities in an open and inclusive setting. The RDC opened in 2002 because the Greater Lansing community identified service area gaps for newcomer populations seeking self-sufficiency. The common denominator in the gaps identified revolved around education  and hence  the mission of the center was born. Today  the RDC helps serve as the link between newcomer populations and the private  public  and faith-based communities of Ingham County.,PROVIDING THE ORIENTATION AND EDUCATION REFUGEES NEED TO BECOME SELF SUFFICIENT MEMBERS OF SOCIETY.,NA,Photo save,NA,NA,This organization is required to file an IRS Form 990 or 990-EZ.,https://www.facebook.com/RefugeeDevelopmentCenter,Welcome Home - Annual Spring Fundraiser  Thursday  May 3 at 5:30 PM - 8 PM EDT  319 Cesar E Chavez  Lansing  Michigan 48906,NA,NA,15/3/2018,
Foundation for Theological Education in Southeast Asia,0,267 WINTER OAK WEST HOLLAND  MI 49424 ,23-7362344,ftewilson@gmail.com,WWW.FTESEA.ORG,616-392-8555,Human Service,The Foundation for Theological Education in Southeast Asia supports Christian theological education in China and South East Asia through grants to institutions and projects  scholarships  consultations  and publications.,PROVIDING THE ORIENTATION AND EDUCATION REFUGEES NEED TO BECOME SELF SUFFICIENT MEMBERS OF SOCIETY.,NA,Photo save,140 West Highland Avenue Philadelphia  PA 19118,215-247-2458,This organization is required to file an IRS Form 990 or 990-EZ.,NA,NA,NA,NA,15/3/2018,
Platinum Care Inc,0,3129 GOLFVIEW DR SALINE  MI 48176 ,20-4399129,NA,NA,NA,Human Service,Non profit organization,PROVIDER OF HOUSING AND SERVICES TO INDIGENT INDIVIDUALS,NA,NA,NA,NA,This organization is required to file an IRS Form 990 or 990-EZ.,NA,NA,NA,NA,15/3/2018,
Livonia Opportunity House A Non-Profit Housing Corporation,0,14147 FARMINGTON RD LIVONIA  MI 48154 ,38-2283045,NA,WWW.cocliving.com,734-422-1020,Human Service,The COC Board of Directors  administrative leadership  and staff are committed to effectively guiding and assisting persons with developmental disabilities to maintain equality  integrity  and respect throughout their lives.,TO PROVIDE QUALITY HOUSING AND COMPREHENSIVE SUPPORT FOR 10 PERSONS WITH DEVELOPMENTAL DISABILITIES AND TO PROVIDE ASSISTANCE AND ADVOCACY TO HELP THEM BECOME INDEPENDENT CITIZENS INVOLVED WITHIN THEIR COMMUNITY.,Whether you???re interested in volunteering regularly  or just helping out when you have the time  we???re grateful for your support. The following are some great ways to get involved: Personalized time spent with individual or person supported by COC. Yard clean up. Gardening. IT assistance. Painting. Snow Shoveling. Deck cleaning and staining. Administrative Office Support.,Photo save,NA,NA,This organization is required to file an IRS Form 990 or 990-EZ.,https://www.facebook.com/pages/Community-Opportunity-Center/139919749396764,NA,NA,NA,15/3/2018,
Kids Campus Inc,0,75 Irving Park Dr Battle Creek  MI 49037 ,38-1426880,NA,NA,269-969-6270,Human Service,Non profit organization,TO CARE FOR CHILDREN IN AN EDUCATIONAL ENVIRONMENT.,NA,Photo save,NA,NA,This organization is required to file an IRS Form 990 or 990-EZ.,https://www.facebook.com/pages/Altrusa-Child-Care-Learning-Centers/154206447949300,NA,NA,NA,15/3/2018,
Relief After Violent Encounter Ionia Montcalm Inc,0,PO BOX 93 IONIA   MI 48846 ,38-3620056,NA,WWW.RAVEIM.ORG,616-527-3351,Human Service,Relief After Violent Encounter - Ionia and Montcalm  Inc. offers free and confidential services to survivors of domestic and sexual violence. RAVE  is committed to supporting  healing and empowering individuals in crisis as well as educating individuals and the community on the power of healthy relationships.,To eliminate the crimes of domestic and sexual violence through programs that support appropriate change. To confront the existing imbalance of power within violent relationships. To support and advocate for the adult and child victims of domestic and sexual violence. To develop programs of empowerment that respect victims??? rights to self-determination,NA,Photo save,NA,800-720-7233,This organization is required to file an IRS Form 990 or 990-EZ.,https://www.facebook.com/pg/RAVE.IM/events/?ref=page_internal,Relief After Violent Encounter-Ionia/Montcalm  Inc. does not have any upcoming events.,NA,NA,15/3/2018,
Team Joseph Inc,0,3050 UNION LAKE RD STE 8F COMMERCE TWP  MI 48382 ,80-0613664,jamminforjoseph@gmail.com,www.teamjoseph.info,248-330-0430,Human Service,Joseph Penrod was diagnosed with Duchenne muscular dystrophy when he was 5 years old. Although a diagnosis can be overwhelming  and a disease of this magnitude can begin to define a child  Joseph has led the way with a positive attitude and a love of life. Hope for Joseph and all the other children with Duchenne is fueled by a mom on a mission and an army of committed volunteers who will not quit until the day there is a cure. ,Team Joseph is a non-profit organization whose mission is to aggressively fund cutting edge research to find a treatment or cure for Duchenne muscular dystrophy. It is our goal that when a parent hears a diagnosis of Duchenne  it is simply a manageable condition and no longer terrifying news. Our focus is on rapidly moving basic research into applications that can make a difference for the current generation of boys afflicted with this devastating disease as well as for generations that aren???t even born yet. We are a caring community of motivated people joined together in efforts to give young boys affected by Duchenne muscular dystrophy  not only a chance at a better life  but simply a chance at a life.,NA,Photo save,5745 W Maple Rd West Bloomfield Township  Michigan,NA,This organization is required to file an IRS Form 990 or 990-EZ.,https://www.facebook.com/teamjosephinfo?fref=ts,Team Joseph does not have any upcoming events.,NA,NA,15/3/2018,
Central Day Care Center,0,4100 BARNES RD TRAVERSE CITY   MI 49684 ,38-1864047,cdcc2011@gmail.com,www.centraldaycarecenter.org,231-947-6131,Human Service,Central Day Care Center is licensed by the Michigan Department of Human Services and by the United States Government.  The Center is open year-round  except for all major holidays  the Friday before Labor Day  the day after Thanksgiving  Christmas Eve and the day after Christmas. ,PROVIDE DAY CARE FOR INFANTS  TODDLERS AND PRE-SCHOOL CHILDREN OF WORKING PARENTS.,NA,Photo save,NA,NA,This organization is required to file an IRS Form 990 or 990-EZ.,https://www.facebook.com/pg/CentralDayCareCenter/about/?ref=page_internal,Central Day Care Center does not have any upcoming events.,NA,NA,15/3/2018,
CHRISTIAN NEIGHBORS S E,0,282 12TH St PO Box 53 Plainwell  MI 49080 USA,38-3451688,info@christianneighbors.org,www.christianneighbors.org,269-685-4166,Human Service,Christian Neighbors is a community agency serving individuals and families in Plainwell  Otsego and Martin school districts.  It is governed by an all volunteer board.,Christian Neighbors SE provides food  emergency financial assistance and education to build sustainability.,NA,Photo save,PO Box 53 Plainwell  MI 49080,NA,This organization is required to file an IRS Form 990 or 990-EZ.,NA,NA,NA,NA,15/3/2018,
United Home Health Services Inc,0,6701 HARRISON ST GARDEN CITY  MI 48135 ,38-2453621,NA,WWW.UHHS.ORG,734-981-8820,Human Service,The mission of United Home Health Services is to provide high quality home health services that are comprehensive  well-coordinated  and cost-effective. This is accomplished through individualized patient management  skilled therapeutic services  and supportive personal assistance delivered by a caring team. UHHS is a not-for-profit  Medicare-certified home health care agency  providing exceptional nursing and therapy services since 1983. Our staff not only addresses physical concerns  but also gives careful attention to the emotional  psychological  social  economic and spiritual needs of our patients. We are committed to excellence and have been delivering exceptional home care for over 30 years.,PROVIDE QUALITY HOME HEALTH SERVICES WHICH ARE COMPREHENSIVE  WELL-COORDINATED & COST EFFECTIVE THROUGH PATIENT MANAGEMENT  THERAPEUTIC SERVICES & PERSONAL ASSISTANCE DELIVERED BY A CARING TEAM.,We have periodic need for volunteers to perform clerical work such as stuffing folders  folding newsletters  etc. If you have a few hours available and are interested in learning more about our current volunteer opportunities  call us at 734-981-8820. No experience necessary!,Photo save,NA,800-968-8447,This organization is required to file an IRS Form 990 or 990-EZ.,https://www.facebook.com/UnitedHomeHealthServices,NA,NA,NA,15/3/2018,
AL-AYN SOCIAL CARE FOUNDATION,0,835 Mason St Suite B-340 Dearborn  MI 48124 USA,47-1614315,s.ahmad@al-ayn.org,www.Al-Ayn.org,313-724-7690,Human Service,Al-Ayn Social Care Foundation is an independent 501(c) (3) humanitarian organization registered and identified as a US public charity established in 2014 under EIN: 47-1614315. Our primary aim is to tend to the millions of orphaned children and thousands of displaced families resulting from war and acts of terrorism. Al-Ayn US works in collaboration with Al-Ayn Iraq which has been awarded consultative status by the United Nations as a Humanitarian NGO.,Providing assistance to all identified and registered individuals who have been orphaned or displaced due to war  acts of terrorism  natural disasters and other causes. Ultimately  our goal is to spread our message on a global level to draw support to our mission from a compassionate global community. In addition  we seek to advocate with the government  local and international humanitarian organizations  and philanthropists to take on the responsibility of caring for orphans and their families.,NA,Photo save,NA,NA,This organization is required to file an IRS Form 990 or 990-EZ.,https://www.facebook.com/alayn.us/,NA,NA,NA,15/3/2018,
Life Resources of Northern Michigan Inc,0,419 N LAKE ST CADILLAC   MI 49601 ,38-3580489,NA,NA,231-775-1545,Human Service,Non profit organization,Life Resources has 5 programs  which provide numerous services: Options Pregnancy Resource Center  Fatherhood Support Services  Positive Choices in Education  Sound Choices Medical Clinic  and Abortion Recovery Care.,NA,Photo save,909 S. Carmel St Cadillac  Michigan,NA,This organization is required to file an IRS Form 990 or 990-EZ.,https://www.facebook.com/pg/liferesourcesnmi/about/?ref=page_internal,Life Resources of Northern Michigan  Inc. does not have any upcoming events.,NA,NA,15/3/2018,
Lenawee County Mission,0,PO BOX 918 ADRIAN   MI 49221 ,20-3801079,NA,NA,517-265-4019,Human Service,EMERGENCY SHELTER PROGRAMS AND MENTAL HEALTH SUBSTANCE ABUSE PROGRAMS,NA,NA,NA,NA,NA,This organization is required to file an IRS Form 990 or 990-EZ.,NA,NA,NA,NA,15/3/2018,
Amens Care Inc,0,9014 ROCKLAND REDFORD   MI 48239 ,86-1149431,NA,NA,313-937-2776,Human Service,Non profit organization,Provide Mental Health Service,NA,NA,NA,NA,This organization is required to file an IRS Form 990 or 990-EZ.,https://www.facebook.com/pages/Amens-Care/162363650459934,NA,NA,NA,15/3/2018,
Days of Discovery Inc,0,3473 S HURON RD BAY CITY   MI 48706 ,38-3250216,daysdiscovery@yahoo.com,NA,989-667-1853,Human Service,Non profit organization,Child Educational and Care service,NA,Photo save,NA,NA,This organization is required to file an IRS Form 990 or 990-EZ.,https://www.facebook.com/pg/Days-Of-Discovery-Day-Care-Center-119704738056927/about/?ref=page_internal,NA,NA,NA,15/3/2018,
On My Own of Michigan  Inc.,0,1250 Kirts Blvd. Suite 300 Troy  MI 48084 USA,38-3366049,bruce@onmyownofmi.org,www.onmyownofmi.org,248-649-3739,Human Service,On My Own of Michigan is a private  non-profit organization 501(c)(3) that was created to assist individuals with mild developmental disabilities become independent and contributing members of the community.,On My Own of Michigan helps adults with mild developmental disabilities become independent  social and contributing members of the community.,NA,Photo save,NA,NA,This organization is required to file an IRS Form 990 or 990-EZ.,https://www.facebook.com/onmyownofmichigan,Family Fun Bowl  18th Mar  Astro Lanes 32388 JohnR Madison Hegihts,NA,NA,15/3/2018,
Good Samaritan Family Services,0,PO BOX 206 ELLSWORTH   MI 49729 ,38-3469219,mary.peterson@thegoodsam.org,WWW.THEGOODSAM.ORG,231-588-2208,Human Service,Good Samaritan reaches out to care for our neighbors in need through our food pantry  resale shop  and furniture store. We turn purchases into food for families in need!,TO PROVIDE FOOD  CLOTHING  HEATING AND OTHER ASSISTANCE TO NEEDY FAMILIES.,NA,Photo save,NA,NA,This organization is required to file an IRS Form 990 or 990-EZ.,https://www.facebook.com/GoodSamaritanFamilyServices,Good Samaritan Family Services does not have any upcoming events.,NA,NA,15/3/2018,
TONI AND TRISH HOUSE FOR THE CARE OF THE TERMINALLY ILL,0,PO Box 125 Auburn  MI 48611 USA,20-5698294,info@toniandtrishhouse.org,www.toniandtrishhouse.org,989-662 6400,Human Service,At Toni and Trish no one dies alone. We provide the absolute best in individualized and compassionate end of life care for all who need it.,At Toni and Trish no one dies alone. We collaborate in the community to provide the absolute best in individualized and compassionate end of life care to all who need it.Care for the Terminally Ill in a safe environment,NA,Photo save,4699 11 Mile Rd Auburn   MI 48611 ,NA,This organization is required to file an IRS Form 990 or 990-EZ.,https://www.facebook.com/Toni-and-Trish-House-for-the-Care-of-the-Terminally-Ill-601502083276062/,Come and See the Toni and Trish House  Tuesday  March 20 at 10:30 AM - 11:30 AM EDT  4699 11 Mile Rd  Auburn  Michigan 48611,Empty Bowls  Wednesday  April 18 at 6 PM - 8:30 PM EDT  614 Center Ave  Bay City  MI 48708-5947  United States,NA,15/3/2018,
Baragaland Senior Citizens Inc,0,6 N MAIN ST LANSE  MI 49946 ,38-2053301,NA,NA,906-524-6711,Human Service,Baragaland located downtown LAnse. A place for seniors to gather.,PROVIDE SERVICES TO SENIOR CITIZENS,NA,Photo save,NA,NA,This organization is required to file an IRS Form 990 or 990-EZ.,https://www.facebook.com/pg/baragaland/about/?ref=page_internal,NA,NA,NA,15/3/2018,
Handprints Christian Early Learning Center Inc,0,38100 UTICA RD STERLING HTS  MI 48312 ,76-0787866,handprints@rockpointe.org,www.handprints.org,586-446-7700,Human Service,Since we opened our doors in 2005  Handprints has been serving the community as a ministry of Rockpointe Community Church.,Handprints is a ministry of Rockpointe Community Church serving families of preschool aged children as well as young elementary school aged children during the summer. We accept children as young as six weeks old.,NA,Photo save,NA,NA,This organization is required to file an IRS Form 990 or 990-EZ.,https://www.facebook.com/Handprints-Christian-Early-Learning-Center-95907016749/,NA,NA,NA,15/3/2018,
INTERNATIONAL INSTITUTE OF METROPOLITAN DETROIT INC,0,111 East Kirby Street Detroit  MI 48202 USA,38-1358200,wojciech517@yahoo.com,www.iimd.org,313-871-8600,Human Service,The International Institute was founded in 1919  by a group of YWCA volunteers  who wanted to assist new legal immigrants to become U.S. citizens  learn English  learn the American way of life  appreciate freedom and democracy  find housing and jobs  and make a positive contribution to their new communities. It was also a goal to preserve the culture and heritage of the native countries - the language  food  music  costumes  literature  art  and crafts  and to share this culture and heritage with the Metro Detroit community.,The International Institute is dedicated to working with foreign-born and with all Americans in the constant task of solving social problems  acculturation  education and acceptance. It provides and utilizes human and physical resources to advance the welfare and the integration of the foreign-born and their relatives; foster community awareness that varied cultures contribute to the richness of American life; and serve other organizations in the areas of its competence.,NA,Photo save,NA,NA,This organization is required to file an IRS Form 990 or 990-EZ.,NA,NA,NA,NA,19/3/2018,
St Vincent Depaul,0,115 W 1st St Tawas City  MI 48763 ,23-7230413,NA,NA,989-362-6584,Human Service,Non profit organization,Donations and Charity. Helping and Serving the Tawas City area since 1970,NA,Photo save,NA,NA,This organization is required to file an IRS Form 990 or 990-EZ.,https://www.facebook.com/pg/St.VinnysTawasMI/about/?ref=page_internal,NA,NA,NA,19/3/2018,
